{
  "format_version": "1.1",
  "generator": {"name": "EDH_matchmaker"},
  "created_at": "2026-08-21T10:00:00+00:00",
  "updated_at": "2026-08-21T11:30:00+00:00",
  "uid": "22222222-2222-2222-2222-222222222222",
  "config": {
    "pod_sizes": [4],
    "allow_bye": true,
    "n_rounds": 1,
    "max_byes": 2,
    "auto_export": false,
    "standings_export": {
      "fields": [0, 2, 4],
      "format": 0,
      "dir": "./logs/standings.txt"
    },
    "global_wr_seats": [0.2470, 0.1928, 0.1672, 0.1458],
    "top_cut": 4,
    "scoring_logic": "ScoringDefault",
    "scoring_params": {
      "win_points": 5,
      "bye_points": 4,
      "draw_points": 1
    }
  },
  "players": [
    {"uid": "aaaaaaaa-0000-0000-0000-000000000001", "name": "P1", "decklist": null},
    {"uid": "aaaaaaaa-0000-0000-0000-000000000002", "name": "P2", "decklist": null},
    {"uid": "aaaaaaaa-0000-0000-0000-000000000003", "name": "P3", "decklist": null},
    {"uid": "aaaaaaaa-0000-0000-0000-000000000004", "name": "P4", "decklist": null},
    {"uid": "aaaaaaaa-0000-0000-0000-000000000005", "name": "P5", "decklist": "https://example.com/decks/p5"}
  ],
  "rounds": [
    {
      "tour": "22222222-2222-2222-2222-222222222222",
      "seq": 0,
      "stage": 0,
      "logic": "PairingSnake",
      "uid": "bbbbbbbb-0000-0000-0000-000000000001",
      "dropped": [],
      "disabled": [],
      "byes": ["aaaaaaaa-0000-0000-0000-000000000005"],
      "game_loss": [],
      "pods": [
        {
          "uid": "cccccccc-0000-0000-0000-000000000001",
          "tour_round": "bbbbbbbb-0000-0000-0000-000000000001",
          "table": 1,
          "cap": 4,
          "result": ["aaaaaaaa-0000-0000-0000-000000000001"],
          "players": [
            "aaaaaaaa-0000-0000-0000-000000000001",
            "aaaaaaaa-0000-0000-0000-000000000002",
            "aaaaaaaa-0000-0000-0000-000000000003",
            "aaaaaaaa-0000-0000-0000-000000000004"
          ]
        }
      ]
    },
    {
      "tour": "22222222-2222-2222-2222-222222222222",
      "seq": 1,
      "stage": 4,
      "logic": "PairingSnake",
      "uid": "bbbbbbbb-0000-0000-0000-000000000002",
      "dropped": [],
      "disabled": ["aaaaaaaa-0000-0000-0000-000000000005"],
      "byes": [],
      "game_loss": [],
      "pods": [
        {
          "uid": "cccccccc-0000-0000-0000-000000000002",
          "tour_round": "bbbbbbbb-0000-0000-0000-000000000002",
          "table": 1,
          "cap": 4,
          "result": [
            "aaaaaaaa-0000-0000-0000-000000000001",
            "aaaaaaaa-0000-0000-0000-000000000002"
          ],
          "players": [
            "aaaaaaaa-0000-0000-0000-000000000001",
            "aaaaaaaa-0000-0000-0000-000000000002",
            "aaaaaaaa-0000-0000-0000-000000000003",
            "aaaaaaaa-0000-0000-0000-000000000004"
          ]
        }
      ]
    }
  ]
}
